{
  "schema": "reply-gated-handoff",
  "handoff_id": "handoff_evt_d9aa_facetime_001",
  "source_request_id": "action_req_evt_d9aa38bdc636459c92ea4e25f665cd0d_urgent_imessage",
  "allowed_followup_actions": ["request_facetime_handoff", "play_tts_utterance"],
  "reply_classification": "affirmative",
  "required_phrase": "yes",
  "live_approval_state": "approved_for_this_attempt",
  "contact_id": "contact_emergency_primary",
  "target_verification": "verified",
  "execution_receipt_required": true
}
